date,transaction,players
2025-12-12,Dodgers signed free agent RHP Edwin Díaz.,['Edwin Díaz']
2025-12-12,Dodgers claimed CF Michael Siani off waivers from Atlanta Braves.,['Michael Siani']
2025-12-10,Dodgers signed free agent LHP Angel Medina to a minor league contract.,['Angel Medina']
2025-12-10,"Houston Astros purchased contract of RF Edwin Sanchez in the Rule 5 Draft, AAA Phase.",['Edwin Sanchez']
2025-12-10,"Pittsburgh Pirates purchased contract of LHP Brandon Neeck in the Rule 5 Draft, AAA Phase.",['Brandon Neeck']
2025-12-10,"Miami Marlins purchased contract of RHP Livan Reinoso in the Rule 5 Draft, AAA Phase.",['Livan Reinoso']
2025-12-04,Dodgers signed free agent 2B Miguel Rojas.,['Miguel Rojas']
2025-11-21,RHP Nick Frasso elected free agency.,['Nick Frasso']
2025-11-21,RHP Evan Phillips elected free agency.,['Evan Phillips']
2025-11-18,Dodgers selected the contract of LHP Ronan Kopp from Oklahoma City Comets.,['Ronan Kopp']
2025-11-17,Dodgers signed free agent C Eliezer Alfonzo to a minor league contract.,['Eliezer Alfonzo']
2025-11-16,Dodgers traded LHP Robinson Ortiz to Seattle Mariners for RHP Tyler Gough.,"['Robinson Ortiz', 'Tyler Gough']"
2025-11-14,Dodgers signed free agent LHP Antoine Kelly to a minor league contract.,['Antoine Kelly']
2025-11-12,Cincinnati Reds claimed C Ben Rortvedt off waivers from Dodgers.,['Ben Rortvedt']
2025-11-12,Dodgers sent RHP Tony Gonsolin outright to Oklahoma City Comets.,['Tony Gonsolin']
2025-11-06,Dodgers activated RHP Gavin Stone from the 60-day injured list.,['Gavin Stone']
2025-11-06,San Francisco Giants claimed CF Justin Dean off waivers from Dodgers.,['Justin Dean']
2025-11-06,Dodgers sent CF Justin Dean outright to Oklahoma City Comets.,['Justin Dean']
2025-11-06,Dodgers selected the contract of LF Ryan Ward from Oklahoma City Comets.,['Ryan Ward']
2025-11-06,Dodgers sent RHP Michael Grove outright to Oklahoma City Comets.,['Michael Grove']
2025-11-06,Dodgers selected the contract of LHP Robinson Ortiz from Oklahoma City Comets.,['Robinson Ortiz']
2025-11-06,Dodgers activated RHP Nick Frasso from the 60-day injured list.,['Nick Frasso']
2025-11-06,Dodgers activated RHP Brusdar Graterol from the 60-day injured list.,['Brusdar Graterol']
2025-11-06,Dodgers designated RHP Tony Gonsolin for assignment.,['Tony Gonsolin']
2025-11-06,Dodgers activated RHP River Ryan from the 60-day injured list.,['River Ryan']
2025-11-06,Dodgers activated RHP Kyle Hurt from the 60-day injured list.,['Kyle Hurt']
2025-11-06,Dodgers activated RHP Evan Phillips from the 60-day injured list.,['Evan Phillips']
2025-11-02,Dodgers activated RHP Bobby Miller.,['Bobby Miller']
2025-11-02,1B Enrique Hernández elected free agency.,['Enrique Hernández']
2025-11-02,Dodgers activated RHP Brock Stewart.,['Brock Stewart']
2025-11-02,2B Miguel Rojas elected free agency.,['Miguel Rojas']
2025-11-02,Dodgers activated RHP Ben Casparius.,['Ben Casparius']
2025-11-02,Dodgers activated SS Alex Freeland.,['Alex Freeland']
2025-11-02,Dodgers activated RHP Landon Knack.,['Landon Knack']
2025-11-02,LHP Andrew Heaney elected free agency.,['Andrew Heaney']
2025-11-02,Dodgers activated LHP Tanner Scott.,['Tanner Scott']
2025-11-02,Dodgers activated LHP Alex Vesia.,['Alex Vesia']
2025-11-02,LF Michael Conforto elected free agency.,['Michael Conforto']
2025-11-02,Dodgers activated C Dalton Rushing.,['Dalton Rushing']
2025-11-02,LHP Clayton Kershaw elected free agency.,['Clayton Kershaw']
2025-11-02,RHP Michael Kopech elected free agency.,['Michael Kopech']
2025-11-02,Dodgers activated RHP Paul Gervase.,['Paul Gervase']
2025-11-02,Dodgers activated LF Esteury Ruiz.,['Esteury Ruiz']
2025-11-02,RHP Kirby Yates elected free agency.,['Kirby Yates']
2025-10-27,Dodgers signed free agent RHP Nick Putnam to a minor league contract.,['Nick Putnam']
2025-10-24,LHP Alex Vesia roster status changed by Dodgers.,['Alex Vesia']
2025-10-24,Dodgers activated RHP Edgardo Henriquez.,['Edgardo Henriquez']
2025-10-24,Dodgers activated RHP Will Klein.,['Will Klein']
2025-10-24,RHP Ben Casparius roster status changed by Dodgers.,['Ben Casparius']
2025-10-20,Dodgers signed free agent RHP Micheal Morfe to a minor league contract.,['Micheal Morfe']
2025-10-13,Dodgers activated RHP Ben Casparius.,['Ben Casparius']
2025-10-13,C Dalton Rushing roster status changed by Dodgers.,['Dalton Rushing']
2025-10-09,LHP Tanner Scott roster status changed by Dodgers.,['Tanner Scott']
2025-10-09,Dodgers signed free agent LHP Junior Pena to a minor league contract.,['Junior Pena']
2025-10-09,Dodgers activated LHP Justin Wrobleski.,['Justin Wrobleski']
2025-10-04,RHP Edgardo Henriquez roster status changed by Dodgers.,['Edgardo Henriquez']
2025-10-04,Dodgers activated LHP Clayton Kershaw.,['Clayton Kershaw']
2025-10-04,Dodgers activated LHP Anthony Banda.,['Anthony Banda']
2025-10-04,LHP Justin Wrobleski roster status changed by Dodgers.,['Justin Wrobleski']
2025-09-30,RHP Bobby Miller roster status changed by Dodgers.,['Bobby Miller']
2025-09-30,LHP Andrew Heaney roster status changed by Dodgers.,['Andrew Heaney']
2025-09-30,LF Esteury Ruiz roster status changed by Dodgers.,['Esteury Ruiz']
2025-09-30,LHP Clayton Kershaw roster status changed by Dodgers.,['Clayton Kershaw']
2025-09-30,RHP Landon Knack roster status changed by Dodgers.,['Landon Knack']
2025-09-30,RHP Michael Kopech roster status changed by Dodgers.,['Michael Kopech']
2025-09-30,LF Michael Conforto roster status changed by Dodgers.,['Michael Conforto']
2025-09-30,LHP Anthony Banda roster status changed by Dodgers.,['Anthony Banda']
2025-09-30,RHP Will Klein roster status changed by Dodgers.,['Will Klein']
2025-09-30,RHP Paul Gervase roster status changed by Dodgers.,['Paul Gervase']
2025-09-30,RHP Brock Stewart roster status changed by Dodgers.,['Brock Stewart']
2025-09-30,RHP Ben Casparius roster status changed by Dodgers.,['Ben Casparius']
2025-09-30,RHP Kirby Yates roster status changed by Dodgers.,['Kirby Yates']
2025-09-30,SS Alex Freeland roster status changed by Dodgers.,['Alex Freeland']
2025-09-29,Dodgers recalled RHP Bobby Miller from Oklahoma City Comets.,['Bobby Miller']
2025-09-29,Dodgers recalled RHP Paul Gervase from Oklahoma City Comets.,['Paul Gervase']
2025-09-29,Dodgers recalled LF Esteury Ruiz from Oklahoma City Comets.,['Esteury Ruiz']
2025-09-29,Dodgers recalled RHP Ben Casparius from Oklahoma City Comets.,['Ben Casparius']
2025-09-29,Dodgers recalled CF Justin Dean from Oklahoma City Comets.,['Justin Dean']
2025-09-29,Dodgers recalled SS Alex Freeland from Oklahoma City Comets.,['Alex Freeland']
2025-09-29,Dodgers recalled LHP Andrew Heaney from Oklahoma City Comets.,['Andrew Heaney']
2025-09-29,Dodgers activated RHP Michael Kopech from the 15-day injured list.,['Michael Kopech']
2025-09-29,Dodgers activated C Will Smith from the 10-day injured list.,['Will Smith']
2025-09-29,Dodgers recalled RHP Will Klein from Oklahoma City Comets.,['Will Klein']
2025-09-29,Dodgers activated RHP Brock Stewart from the 15-day injured list.,['Brock Stewart']
2025-09-29,Dodgers activated RHP Kirby Yates from the 15-day injured list.,['Kirby Yates']
2025-09-28,Dodgers optioned LHP Andrew Heaney to Oklahoma City Comets.,['Andrew Heaney']
2025-09-28,Dodgers recalled RHP Landon Knack from Oklahoma City Comets.,['Landon Knack']
2025-09-27,Dodgers optioned RHP Will Klein to Oklahoma City Comets.,['Will Klein']
2025-09-27,Dodgers selected the contract of LHP Andrew Heaney from Oklahoma City Comets.,['Andrew Heaney']
2025-09-27,Dodgers recalled RHP Nick Frasso from Oklahoma City Comets.,['Nick Frasso']
2025-09-24,"Dodgers placed RHP Kirby Yates on the 15-day injured list retroactive to September 21, 2025. Right hamstring strain.",['Kirby Yates']
2025-09-24,Dodgers activated RHP Roki Sasaki from the 60-day injured list.,['Roki Sasaki']
2025-09-21,Atlanta Braves claimed C Chuckie Robinson off waivers from Dodgers.,['Chuckie Robinson']
2025-09-19,Dodgers placed RHP Michael Kopech on the 15-day injured list. Right knee inflammation.,['Michael Kopech']
2025-09-19,Dodgers recalled RHP Will Klein from Oklahoma City Comets.,['Will Klein']
2025-09-18,Dodgers signed free agent RHP Matt Sauer to a minor league contract.,['Matt Sauer']
2025-09-16,Dodgers activated C Dalton Rushing from the 10-day injured list.,['Dalton Rushing']
2025-09-16,Dodgers optioned C Chuckie Robinson to Oklahoma City Comets.,['Chuckie Robinson']
2025-09-16,SS Mookie Betts changed number to 50.,['Mookie Betts']
2025-09-16,1B Enrique Hernández changed number to 8.,['Enrique Hernández']
